{
  "$schema": "https://json-schema.org/draft/2020-12/schema",
  "$id": "https://defiantinds.com/schemas/dgce/game_adapter/stage3_review_bundle.v1.schema.json",
  "title": "game_adapter_stage3_review_bundle",
  "type": "object",
  "additionalProperties": false,
  "required": [
    "artifact_type",
    "contract_name",
    "contract_version",
    "adapter",
    "domain",
    "review_id",
    "section_id",
    "created_at",
    "source_preview_fingerprint",
    "source_input_fingerprint",
    "review_status",
    "review_summary",
    "proposed_changes",
    "dependency_notes",
    "operator_questions",
    "approval_readiness",
    "evidence",
    "forbidden_runtime_actions"
  ],
  "properties": {
    "artifact_type": {
      "const": "game_adapter_stage3_review_bundle"
    },
    "contract_name": {
      "const": "DGCEGameAdapterStage3ReviewBundle"
    },
    "contract_version": {
      "const": "dgce.game_adapter.stage3.review_bundle.v1"
    },
    "adapter": {
      "const": "game"
    },
    "domain": {
      "const": "game_adapter"
    },
    "review_id": {
      "$ref": "#/$defs/SafeIdentifier"
    },
    "section_id": {
      "$ref": "#/$defs/SafeIdentifier"
    },
    "created_at": {
      "type": "string",
      "format": "date-time",
      "pattern": "^\\d{4}-\\d{2}-\\d{2}T\\d{2}:\\d{2}:\\d{2}(?:\\.\\d+)?(?:Z|[+-]\\d{2}:\\d{2})$"
    },
    "source_preview_fingerprint": {
      "$ref": "#/$defs/Fingerprint"
    },
    "source_input_fingerprint": {
      "anyOf": [
        {
          "$ref": "#/$defs/Fingerprint"
        },
        {
          "type": "null"
        }
      ]
    },
    "review_status": {
      "enum": [
        "ready_for_operator_review",
        "blocked"
      ]
    },
    "review_summary": {
      "$ref": "#/$defs/ReviewSummary"
    },
    "proposed_changes": {
      "type": "array",
      "maxItems": 100,
      "items": {
        "$ref": "#/$defs/ProposedChange"
      }
    },
    "dependency_notes": {
      "type": "array",
      "maxItems": 100,
      "items": {
        "$ref": "#/$defs/BoundedText"
      }
    },
    "operator_questions": {
      "type": "array",
      "maxItems": 50,
      "items": {
        "$ref": "#/$defs/BoundedText"
      }
    },
    "approval_readiness": {
      "$ref": "#/$defs/ApprovalReadiness"
    },
    "evidence": {
      "type": "array",
      "maxItems": 100,
      "items": {
        "$ref": "#/$defs/EvidenceItem"
      }
    },
    "forbidden_runtime_actions": {
      "type": "array",
      "minItems": 1,
      "maxItems": 16,
      "uniqueItems": true,
      "items": {
        "$ref": "#/$defs/ForbiddenRuntimeAction"
      }
    }
  },
  "$defs": {
    "Fingerprint": {
      "type": "string",
      "minLength": 64,
      "maxLength": 64,
      "pattern": "^[a-f0-9]{64}$"
    },
    "SafeIdentifier": {
      "type": "string",
      "minLength": 1,
      "maxLength": 128,
      "pattern": "^[A-Za-z0-9_.:/+#-]+$"
    },
    "SafeRelativePath": {
      "type": "string",
      "minLength": 1,
      "maxLength": 260,
      "pattern": "^(?!/)(?!.*\\\\)(?!.*(?:^|/)\\.\\.(?:/|$))[A-Za-z0-9_./:+#-]+$"
    },
    "BoundedText": {
      "type": "string",
      "minLength": 1,
      "maxLength": 512
    },
    "ReviewSummary": {
      "type": "object",
      "additionalProperties": false,
      "required": [
        "title",
        "primary_intent",
        "operator_summary",
        "risk_summary"
      ],
      "properties": {
        "title": {
          "$ref": "#/$defs/BoundedText"
        },
        "primary_intent": {
          "$ref": "#/$defs/BoundedText"
        },
        "operator_summary": {
          "$ref": "#/$defs/BoundedText"
        },
        "risk_summary": {
          "$ref": "#/$defs/BoundedText"
        }
      }
    },
    "TargetKind": {
      "enum": [
        "blueprint",
        "cpp",
        "asset",
        "config",
        "documentation",
        "unknown"
      ]
    },
    "Operation": {
      "enum": [
        "create",
        "modify",
        "ignore"
      ]
    },
    "OutputStrategy": {
      "enum": [
        "blueprint",
        "cpp",
        "both",
        "none",
        "unknown"
      ]
    },
    "ReviewRisk": {
      "enum": [
        "low",
        "medium",
        "high"
      ]
    },
    "ProposedChange": {
      "type": "object",
      "additionalProperties": false,
      "required": [
        "change_id",
        "target_path",
        "target_kind",
        "operation",
        "output_strategy",
        "human_readable_summary",
        "review_risk"
      ],
      "properties": {
        "change_id": {
          "$ref": "#/$defs/SafeIdentifier"
        },
        "target_path": {
          "$ref": "#/$defs/SafeRelativePath"
        },
        "target_kind": {
          "$ref": "#/$defs/TargetKind"
        },
        "operation": {
          "$ref": "#/$defs/Operation"
        },
        "output_strategy": {
          "$ref": "#/$defs/OutputStrategy"
        },
        "human_readable_summary": {
          "$ref": "#/$defs/BoundedText"
        },
        "review_risk": {
          "$ref": "#/$defs/ReviewRisk"
        }
      }
    },
    "ApprovalReadiness": {
      "type": "object",
      "additionalProperties": false,
      "required": [
        "ready_for_approval",
        "blocking_review_issues_count",
        "informational_review_issues_count"
      ],
      "properties": {
        "ready_for_approval": {
          "type": "boolean"
        },
        "blocking_review_issues_count": {
          "type": "integer",
          "minimum": 0,
          "maximum": 100
        },
        "informational_review_issues_count": {
          "type": "integer",
          "minimum": 0,
          "maximum": 100
        }
      }
    },
    "EvidenceSource": {
      "enum": [
        "preview",
        "unreal_manifest",
        "symbol_candidate_index",
        "resolver",
        "alignment",
        "operator_context"
      ]
    },
    "EvidenceItem": {
      "type": "object",
      "additionalProperties": false,
      "required": [
        "source",
        "reference"
      ],
      "properties": {
        "source": {
          "$ref": "#/$defs/EvidenceSource"
        },
        "reference": {
          "$ref": "#/$defs/BoundedText"
        },
        "snippet_hash": {
          "$ref": "#/$defs/Fingerprint"
        }
      }
    },
    "ForbiddenRuntimeAction": {
      "enum": [
        "no_approval_granted",
        "no_execution_performed",
        "no_stage8_write_instructions",
        "no_blueprint_mutation",
        "no_unreal_project_writes",
        "no_binary_blueprint_parsing",
        "no_simulation_run",
        "no_guardrail_policy_decision"
      ]
    }
  }
}
